{"budget":{"max_edges":16,"max_groups":0,"max_nodes":12,"max_page_nodes":6,"max_record_nodes":2,"max_source_nodes":3,"max_text_nodes":1},"ckb":{"agent_pack_path":"C:\\fixture\\CKB 输出\\machine\\agent-packs\\pack-0001.md","agent_pack_sha256":"4862f447f2c7f272fa2f4aaf89dadb3b1ac09105bd5864f8d1a0c9452bb0a226","frozen_evidence":{"human_files":[{"relative_path":"INDEX.md","sha256":"1bc04b5291c26a46d918139138b992d2de976d6851d0893b0476b85bfbdfc6e6"},{"relative_path":"pages/audit_obsidian 与 prepare_vault 的协作实现.md","sha256":"3660315a9af3df255d8f19ab077e4797822b41488a0e2a04bc6af71213c23274"},{"relative_path":"sessions/人类可读性样例确认与第一开发波次派发.md","sha256":"2dd8605db2cc79dbe8af4d0fb5d3c53045d83dfe35aec592ee9b0cd0ffbbe506"}],"source_files":[{"relative_path":"scripts/ckb_core/obsidian.py","sha256":"41cf6794ba4200b839c53531555f0f3998df4cbb01a4d5cb0b94e3ca5e23947d"}]},"human_manifest_path":"C:\\fixture\\CKB 输出\\human\\manifest.json","human_manifest_sha256":"05b3abf2579a5eb66403cd78be557fd860633a1fe2103c7642030defe32c657f","human_projection_path":"C:\\fixture\\CKB 输出\\human\\projection.json","human_projection_sha256":"1b250ea199bec73d392caad39d1167d6edc43c81f20edead86eea52c52b94fc1","human_root":"C:\\fixture\\CKB 输出\\human","local_openers_path":"C:\\fixture\\CKB 输出\\local-openers.json","local_openers_sha256":"2623e98faab7052f6652904fceff92c4bbcb9857c96f93a493fcc9d9a76a4f62","machine_index_path":"C:\\fixture\\CKB 输出\\machine\\knowledge.sqlite","machine_index_sha256":"7bdc25d1694ef984782a16f6f1710c1c6bc83ba7a131b515baf532bea021d011","output_root":"C:\\fixture\\CKB 输出","record_path":"C:\\fixture\\CKB 输出\\machine\\agent-packs\\pack-0001.json","record_schema_version":3,"record_sha256":"70ce871f8a3d3fb449bc3c3ace6547cef02dfc74ffe48d912532a724bfdbe5b9","snapshot_commit":"150a1ce8ea3fca0f7ce2f56c731d42a9973ee0e3","snapshot_tree":"7976883a0f6ff177deb649eaef6e8d2e7af2fda8","state_path":"C:\\fixture\\CKB 输出\\state.json","state_sha256":"4ba69735ca53765ed6a709edb56c6ea236b7193a3b29a6b390c346f0f4340e4e"},"mode":"agent-pack-navigation","request":{"authorized_staging_root":"C:\\fixture\\交付\\暂存","backup_root":"C:\\fixture\\交付\\暂存\\.ckb-canvas-backups\\request-0001","baseline":{"canvas":{"state":"absent"},"rollback_manifest":{"state":"absent"},"validation_manifest":{"state":"absent"}},"replace":false,"required_entries":[{"kind":"selected_entity","ordinal":0,"require":"page-and-source"},{"kind":"related_document","ordinal":0,"require":"record"}],"source_link_mode":"verified-editor-uri","target_canvas_path":"C:\\fixture\\交付\\暂存\\ckb-navigation.canvas","title":"CKB Canvas 导航"},"schema_version":1}
